{
  "rule_id": "00000000-0000-0000-0000-000000000205",
  "rule_name": "תוספת קצבה - מרחק עבודה",
  "source_document_id": "mobility-guide-employment",
  "source_section": "תדריך ניידות - השתכרות - תוספת קצבה",
  "effective_date": "1977-06-01",
  "expiry_date": null,
  "priority": "statutory",
  "conditions": {
    "type": "AND",
    "operands": [
      { "type": "COMPARISON", "variable": "is_employed", "operator": "eq", "value": true },
      { "type": "COMPARISON", "variable": "has_vehicle", "operator": "eq", "value": true },
      { "type": "COMPARISON", "variable": "work_distance_km_round_trip", "operator": "gte", "value": 40 },
      { "type": "COMPARISON", "variable": "months_employed", "operator": "gte", "value": 6 }
    ]
  },
  "actions": [
    { "action_type": "determine_eligibility", "parameters": { "outcome": "eligible", "benefit_type": "mobility_allowance_supplement", "note": "זכאי לתוספת קצבת ניידות - מרחק עבודה 40 ק\"מ+ הלוך וחזור, עובד 6 חודשים לפחות" } }
  ],
  "legal_citation": {
    "document_name": "תדריך ניידות",
    "section": "השתכרות",
    "paragraph": "תוספת קצבה",
    "clause": null
  },
  "discretionary_flag": false,
  "discretionary_reason": null,
  "decision_tree": {
    "node_id": "ges-root",
    "node_type": "condition",
    "condition": {
      "type": "AND",
      "operands": [
        { "type": "COMPARISON", "variable": "is_employed", "operator": "eq", "value": true },
        { "type": "COMPARISON", "variable": "has_vehicle", "operator": "eq", "value": true },
        { "type": "COMPARISON", "variable": "work_distance_km_round_trip", "operator": "gte", "value": 40 },
        { "type": "COMPARISON", "variable": "months_employed", "operator": "gte", "value": 6 }
      ]
    },
    "true_branch": {
      "node_id": "ges-eligible",
      "node_type": "leaf",
      "outcome": "eligible",
      "legal_citation": { "document_name": "תדריך ניידות", "section": "השתכרות", "paragraph": "תוספת קצבה", "clause": null },
      "depth": 1
    },
    "false_branch": {
      "node_id": "ges-not-eligible",
      "node_type": "leaf",
      "outcome": "not_eligible",
      "legal_citation": { "document_name": "תדריך ניידות", "section": "השתכרות", "paragraph": "תוספת קצבה", "clause": null },
      "depth": 1
    },
    "legal_citation": { "document_name": "תדריך ניידות", "section": "השתכרות", "paragraph": "תוספת קצבה", "clause": null },
    "depth": 0
  }
}
