{
  "rule_id": "00000000-0000-0000-0000-000000000008",
  "rule_name": "מניעת כפל גמלאות (חוזר 1936)",
  "source_document_id": "circular-1936",
  "source_section": "חוזר 1936 - כפלים באגף גמלאות",
  "effective_date": "2011-01-01",
  "expiry_date": null,
  "priority": "circular",
  "conditions": {
    "type": "AND",
    "operands": [
      { "type": "COMPARISON", "variable": "has_existing_benefit", "operator": "eq", "value": true },
      { "type": "COMPARISON", "variable": "existing_benefit_type", "operator": "in", "value": ["mobility_allowance", "vehicle_grant", "vehicle_less_allowance"] }
    ]
  },
  "actions": [
    { "action_type": "determine_eligibility", "parameters": { "outcome": "not_eligible", "benefit_type": "duplicate_prevention", "note": "נמצא כפל גמלאות - לא ניתן לאשר הטבה נוספת מאותו סוג" } }
  ],
  "legal_citation": {
    "document_name": "חוזר 1936",
    "section": "כפלים באגף גמלאות",
    "paragraph": "1",
    "clause": null
  },
  "discretionary_flag": false,
  "discretionary_reason": null,
  "decision_tree": {
    "node_id": "c1936-root",
    "node_type": "condition",
    "condition": {
      "type": "AND",
      "operands": [
        { "type": "COMPARISON", "variable": "has_existing_benefit", "operator": "eq", "value": true },
        { "type": "COMPARISON", "variable": "existing_benefit_type", "operator": "in", "value": ["mobility_allowance", "vehicle_grant", "vehicle_less_allowance"] }
      ]
    },
    "true_branch": {
      "node_id": "c1936-duplicate-blocked",
      "node_type": "leaf",
      "outcome": "not_eligible",
      "legal_citation": { "document_name": "חוזר 1936", "section": "כפלים באגף גמלאות", "paragraph": "1", "clause": null },
      "depth": 1
    },
    "false_branch": {
      "node_id": "c1936-no-duplicate",
      "node_type": "leaf",
      "outcome": "eligible",
      "legal_citation": { "document_name": "חוזר 1936", "section": "כפלים באגף גמלאות", "paragraph": "1", "clause": null },
      "depth": 1
    },
    "legal_citation": { "document_name": "חוזר 1936", "section": "כפלים באגף גמלאות", "paragraph": "1", "clause": null },
    "depth": 0
  }
}
