{
  "rule_id": "00000000-0000-0000-0000-000000000206",
  "rule_name": "קרן הלוואות - רוכש לראשונה",
  "source_document_id": "mobility-guide-loan-fund",
  "source_section": "תדריך ניידות - קרן הלוואות - רוכש לראשונה",
  "effective_date": "1977-06-01",
  "expiry_date": null,
  "priority": "statutory",
  "conditions": {
    "type": "AND",
    "operands": [
      { "type": "COMPARISON", "variable": "wheelchair_user", "operator": "eq", "value": true },
      { "type": "COMPARISON", "variable": "has_standing_loan_approval", "operator": "eq", "value": true },
      { "type": "COMPARISON", "variable": "vehicle_has_special_equipment", "operator": "eq", "value": true },
      { "type": "COMPARISON", "variable": "has_not_purchased_vehicle", "operator": "eq", "value": true }
    ]
  },
  "actions": [
    { "action_type": "determine_eligibility", "parameters": { "outcome": "eligible", "benefit_type": "loan", "note": "זכאי להלוואה מקרן הלוואות - רוכש לראשונה, מרותק לכיסא גלגלים, 80% ממחיר רכב חדש" } }
  ],
  "legal_citation": {
    "document_name": "תדריך ניידות",
    "section": "קרן הלוואות",
    "paragraph": "רוכש לראשונה",
    "clause": null
  },
  "discretionary_flag": false,
  "discretionary_reason": null,
  "decision_tree": {
    "node_id": "glfb-root",
    "node_type": "condition",
    "condition": {
      "type": "AND",
      "operands": [
        { "type": "COMPARISON", "variable": "wheelchair_user", "operator": "eq", "value": true },
        { "type": "COMPARISON", "variable": "has_standing_loan_approval", "operator": "eq", "value": true },
        { "type": "COMPARISON", "variable": "vehicle_has_special_equipment", "operator": "eq", "value": true },
        { "type": "COMPARISON", "variable": "has_not_purchased_vehicle", "operator": "eq", "value": true }
      ]
    },
    "true_branch": {
      "node_id": "glfb-eligible",
      "node_type": "leaf",
      "outcome": "eligible",
      "legal_citation": { "document_name": "תדריך ניידות", "section": "קרן הלוואות", "paragraph": "רוכש לראשונה", "clause": "80% ממחיר רכב חדש" },
      "depth": 1
    },
    "false_branch": {
      "node_id": "glfb-not-eligible",
      "node_type": "leaf",
      "outcome": "not_eligible",
      "legal_citation": { "document_name": "תדריך ניידות", "section": "קרן הלוואות", "paragraph": "רוכש לראשונה", "clause": null },
      "depth": 1
    },
    "legal_citation": { "document_name": "תדריך ניידות", "section": "קרן הלוואות", "paragraph": "רוכש לראשונה", "clause": null },
    "depth": 0
  }
}
